Item Number,Book Title,Used Price,New Price,Review Count,Publisher,Item Weight,Sales Rank,Book Rank,Genre,Timestamp

0062073419,Sidney Sheldon's Angel of the Dark,$0.10,$2.89,301,"William Morrow (April 3, 2012)",1,"800,831",19290,,"Romance, Mystery, Thriller & Suspense, Suspense, Romantic Suspense, Thrillers & Suspense",2017-12-13 11:57:16
067976982X,"American Academy of Pediatrics Guide to Your Child's Allergies and Asthma: Breathing Easy and Bringing Up Healthy, Active Children",$0.01,$5.00,4,Villard; 1 edition (June 2000),8,"2,560,274",76,,"Respiratory, Allergies, Health, Fitness & Dieting, Lung & Respiratory Diseases, Children's Health, Diseases & Physical Ailments",2017-12-13 11:57:39
0066620120,Now or Never: How Companies Must Change to Win the Battle for Internet Consumers,$1.35,$2.00,26,"HarperBusiness; 1st edition (December 8, 1999)",1,"6,611,209",1558,,"Industries, Internet & Social Media, E-Commerce, Retailing, Business & Money, Planning & Forecasting, Management & Leadership, Computers & Technology",2017-12-13 11:57:43
0618138730,"Having Twins And More: A Parent's Guide to Multiple Pregnancy, Birth, and Early Childhood",$1.44,$3.50,111,"Mariner Books; 3 edition (July 24, 2003)",2,"845,133",52,,"Health, Fitness & Dieting, Allied Health Professions, Parenting & Relationships, General, Twins & Multiples, Women's Health, Medical Books, Family Relationships",2017-12-13 11:58:01
1597898228,A Texas Legacy Christmas (Texas Legacy Series #4),$0.10,$1.28,73,"Barbour Publishing, Inc (September 1, 2007)",0,"2,217,318",23046,,"Romance, Genre Fiction, Religious & Inspirational, Christian Books & Bibles, Literature & Fiction",2017-12-13 11:58:10
0764222732,As You Wish (Christy and Todd: The College Years #2),$5.00,$60.52,73,7 and up<br/>,11,"1,476,201",1518,,"Christian, Children's Books, Christianity, Religions, Religious Fiction, Teens, Religious, Literature & Fiction",2017-12-13 11:58:16
0061374539,Full of Grace,$0.10,$5.50,261,"William Morrow Paperbacks; Reprint edition (June 24, 2008)",9,"96,217",1395,,"Contemporary, Family Life, Domestic Life, Literature & Fiction, Genre Fiction, Women's Fiction",2017-12-13 11:58:22
B00DGDLBTM,Beloved Impostor,$1.02,$20.00,21,B00DGDLBTM,12,"10,337,525",,,,2017-12-13 11:58:26
0939613158,Timeless Super Achievers,$1.10,$2.11,,"Personal Selling Power, Incorporated; First Edition edition (1998)",13,"8,963,132",,,,2017-12-13 11:58:36
0310205719,The Purpose Driven Life,$0.25,$3.00,4,"Zondervan; 1st edition (October 8, 2002)",1,"14,555",85,,"Spiritual, Self Help, Self-Help, Christian Living, Spiritual Growth, Christian Books & Bibles",2017-12-13 11:58:46
0758214448,Out Of This World,$1.02,$5.82,30,"Brava; First Edition edition (September 1, 2006)",10,"2,016,981",30669,,"Romance, Romantic Comedy, Paranormal, Contemporary",2017-12-13 11:58:50
1118083148,Betty Crocker Living with Cancer Cookbook (Betty Crocker Cooking),$1.44,$5.25,39,288 pages,2,"452,896",90,,"Health, Fitness & Dieting, Cancer, Cookbooks, Food & Wine, Special Diet, Other Diets, Diets & Weight Loss",2017-12-13 11:59:12
0312940572,Close Case (Samantha Kincaid Mysteries),$0.60,$5.11,56,368 pages,6,"645,129",1382,,"Mystery, Thrillers & Suspense, Legal, Suspense, Women Sleuths, Mystery, Thriller & Suspense",2017-12-13 11:59:21
0738209023,"What Matters Most: How A Small Group Of Pioneers Is Teaching Social Responsibility To Big Business, And Why Big Business Is Listening",$1.99,$1.37,9,"Basic Books (December 24, 2003)",1,"5,266,471",3895,,"Environmental Economics, Economics, Business & Money, Development & Growth, Sustainable Development",2017-12-13 11:59:27
0452297648,The House at Tyneford: A Novel,$1.70,$18.99,405,"G.P. Putnam's Sons; Reprint edition (December 27, 2011)",10,"83,122",129,,"Jewish, 20th Century, Romance, Historical, Genre Fiction, Religious & Inspirational, Literature & Fiction",2017-12-13 11:59:34
0316778001,The Baby Book: Everything You Need to Know About Your Baby from Birth to Age Two (Revised and Updated Edition),$0.25,$10.24,1,769 pages,1,"221,289",444,,"Health, Fitness & Dieting, Children's Health, Medical Books, Child Psychology, Psychology & Counseling, Psychology",2017-12-13 11:59:41
0316666343,The Lovely Bones,$0.10,$4.91,4,"Little, Brown and Company; 1st edition (June 2, 2002)",1,"71,196",1156,,"Thrillers & Suspense, Psychological Thrillers, Contemporary, Literary, Mystery, Thriller & Suspense, Literature & Fiction",2017-12-13 11:59:50
0312243383,"NeanderThin: Eat Like a Caveman to Achieve a Lean, Strong, Healthy Body",$1.80,$8.52,113,St. Martin's Press; 1st edition (November 1999),13,"967,991",563,,"Low Carb, Health, Fitness & Dieting, Cookbooks, Food & Wine, Weight Loss, Diets & Weight Loss, Low Carbohydrate, Special Diet",2017-12-13 11:59:58
0345520904,"Now Eat This!: 150 of America's Favorite Comfort Foods, All Under 350 Calories",$1.09,$6.79,502,"Ballantine Books; 1 edition (March 2, 2010)",1,"47,935",100,,"U.S. Regional, Cookbooks, Food & Wine, Weight Loss, Low Fat, Regional & International, Special Diet",2017-12-13 12:00:08
0842384154,Shadowed (Underground Zealot Series #3),$0.10,$7.68,93,"Tyndale House Publishers, Inc. (April 1, 2006)",11,"358,615",405,,"Mystery & Suspense, Political, Spies & Politics, Science Fiction, Thrillers & Suspense, Mystery, Thriller & Suspense, Christian Books & Bibles, Literature & Fiction",2017-12-13 12:00:19
0312348126,Don't Look Down,$0.25,$3.00,182,"St. Martin's Press; First Edition edition (April 4, 2006)",1,"1,206,173",4136,,"Romance, Humor, Humorous, Romantic Comedy, United States, Humor & Satire, Literature & Fiction",2017-12-13 12:00:25
0778323625,Country Brides: A Little Bit Country,$0.99,$4.99,51,"MIRA; Reprint edition (June 19, 2007)",4,"1,930,661",52402,,"Romance, Contemporary, Literature & Fiction",2017-12-13 12:00:32
0972553703,Dr. Nicholas Romanov's Pose Method of Running,$1.99,$34.00,74,"Pose Tech Corp; First Edition edition (December 16, 2002)",1,"2,182,691",2965,,"Individual Sports, Exercise & Fitness, Health, Fitness & Dieting, Sports & Outdoors, Running & Jogging",2017-12-13 12:00:49
1606529862,No More Brain Drain: Proven Ways to Maintain Your Mind and Memories,$0.25,$2.50,3,The Reader's Digest Association; First Edition edition (2009),2,"1,867,858",,,,2017-12-13 12:01:00
0312368070,Quicksand: An Eve Duncan Forensics Thriller,$0.25,$2.00,117,379 pages,7,"323,277",1616,,"Mystery, Kidnapping, Thrillers & Suspense, Crime, Suspense, Women Sleuths, Mystery, Thriller & Suspense",2017-12-13 12:01:12
0743212541,Faith And The Good Thing,$4.95,$77.22,4,"Scribner; Annotated edition edition (January 10, 2001)",9,"2,208,110",59492,,"Literary, Contemporary, Literature & Fiction",2017-12-13 12:01:21
0060722223,"Bootcamp360 for Brides: The Few, the Proud, the Fit",$2.50,$2.88,9,"William Morrow Paperbacks (December 28, 2004)",14,"4,552,052",2402,,"Crafts, Hobbies & Home, Health, Fitness & Dieting, Weddings, General, Women's Health, Beauty, Grooming, & Style",2017-12-13 12:01:28
0312254725,The Women's Complete Wellness Book,$2.50,$5.45,4,"Golden Guides from St. Martin's Press; 1st edition (March 16, 2000)",2,"9,934,197",5169,,"Health, Fitness & Dieting, Women's Health, Reference, General",2017-12-13 12:01:37
0553096060,Sein Language,$0.10,$3.57,152,"Bantam (September 1, 1993)",14,"148,701",682,,"Humor, Essays & Correspondence, United States, Humor & Entertainment, Essays, Literature & Fiction",2017-12-13 12:01:46
0373297130,How to Sin Successfully,$1.32,$65.24,5,"Harlequin (October 16, 2012)",4,"4,121,234",21159,,"Romance, Regency, United States, Historical, Literature & Fiction",2017-12-13 12:01:53
0446679593,Suzanne's Diary for Nicholas,$0.10,$2.99,1,"Grand Central Publishing; Grand Central Pub ed. edition (April 1, 2002)",10,"53,473",903,,"Contemporary Women, Thrillers & Suspense, Psychological Thrillers, Contemporary, Mystery, Thriller & Suspense, Women's Fiction, Literature & Fiction",2017-12-13 12:01:59
0451200144,Sun Hawk,$0.92,$25.46,9,"Signet (May 1, 2000)",5,"861,239",24792,,"Romance, Historical",2017-12-13 12:02:05
051513631X,Christmas Revels,$11.98,$11.99,44,"Jove; Reissue edition (October 25, 2005)",8,"1,552,591",11300,,"Romance, Anthologies, Historical",2017-12-13 12:02:11
1591451132,The Yellow Rose (Lone Star Legacy #2),$1.95,$3.59,15,"Thomas Nelson (June 9, 2004)",1,"843,771",771,,"Historical, Mothers & Children, Literature & Fiction, Genre Fiction, Religious & Inspirational, Christian Books & Bibles, Women's Fiction",2017-12-13 12:02:23
1576739252,"The Healer (O'Malley Series, Book 5)",$1.00,$4.00,191,375 pages,9,"2,439,585",4459,,"Contemporary, Romance, Genre Fiction, Religious & Inspirational, Christian Books & Bibles, Literature & Fiction",2017-12-13 12:02:31
0802140246,In the Deep Heart's Core,$2.16,$22.00,28,"Grove Press; Reprint edition (August 6, 2003)",12,"684,153",211,,"Special Education, Politics & Social Sciences, Poverty, Reform & Policy, Education Theory, Schools & Teaching, Education & Teaching, Social Sciences, Behavioral Disorders",2017-12-13 12:02:40
B005KNS40K,"Religion and Politics in America: Faith, Culture, and Strategic Choices",,,5,Westview Pr (1998),,"16,117,233",2315,,"Politics & Social Sciences, Politics & Government, Cultural Policy, Public Affairs & Policy, Civil Rights & Liberties, Specific Topics",2017-12-13 12:02:45
B0084QS28O,The Doomsday Key,$0.99,$2.86,,"HarperCollins (January 1, 2009)",1,"887,482",,,,2017-12-13 12:02:53
0446577081,Inside the Kingdom: My Life in Saudi Arabia,$0.10,$4.10,219,"Grand Central Publishing; First Edition edition (July 14, 2004)",1,"1,253,629",138,,"Biographies & Memoirs, Saudi Arabia, Middle East, Historical, World, Women in History, History",2017-12-13 12:03:06
0061121401,"Grow Your Money!: 101 Easy Tips to Plan, Save, and Invest",$0.25,$7.59,11,"HarperBusiness (December 4, 2007)",1,"1,704,769",1482,,"Investing, Introduction, Personal Finance, Budgeting & Money Management, Business & Money, Retirement Planning",2017-12-13 12:03:12
0060817585,Empress: A Novel,$0.10,$9.18,49,"Harper; 1st Us Edition edition (May 2, 2006)",1,"1,888,912",469,,"Chinese, World Literature, French, Literary, Asian, Literature & Fiction, European",2017-12-13 12:03:22
0375503994,Shrub: The Short but Happy Political Life of George W. Bush,$0.34,$2.98,141,"Random House; 1st edition (February 15, 2000)",13,"925,671",4831,,"United States, Biographies & Memoirs, Politics & Social Sciences, Politics & Government, Political, Historical, Leaders & Notable People, Political Science",2017-12-13 12:03:33
0787902691,The Leadership Challenge: How to Keep Getting Extraordinary Things Done in Organizations,$1.29,$2.50,54,405 pages,1,"1,253,124",4933,,"Motivational, Entrepreneurship, Leadership, Business & Money, Management & Leadership, Small Business & Entrepreneurship",2017-12-13 12:03:39
006174266X,Ungifted,$0.10,$4.91,384,5 - 6<br/>,13,"153,909",1546,,"School, Humor, Friendship, Social Skills & School Life, Children's Books, Growing Up & Facts of Life, Friendship",2017-12-13 12:03:46
1414324375,Springtime of the Spirit (The Great War),$3.55,$6.49,61,400 pages,11,"2,137,189",2827,,"20th Century, Clean & Wholesome, Romance, Historical, Christian Books & Bibles, Literature & Fiction",2017-12-13 12:03:54
B0084QS28O,The Doomsday Key,$0.99,$2.86,,"HarperCollins (January 1, 2009)",1,"887,482",,,,2017-12-13 12:04:02
0449004570,N is for Noose (Kinsey Millhone Mysteries),$0.10,$3.90,392,Fawcett Books (1999),11,"3,999,539",318427,,"Mystery, Thriller & Suspense, Literature & Fiction",2017-12-13 12:04:12
0465045901,Smash Mouth: Two Years In The Gutter With Al Gore And George W. Bush -- Notes From The 2000 Campaign Trail,$0.01,$5.50,10,"Basic Books; 1St Edition edition (January 19, 2001)",1,"4,101,632",3315,,"Politics & Social Sciences, Politics & Government, National, Elections, United States, Elections & Political Process, Political Parties",2018-01-04 12:13:26
0688053068,Robert's Rules of Order,,,392,"William Morrow &amp; Co; Revised edition (June 1, 1971)",9,"6,186,232",316,,"Textbooks, Rules & Procedures, Civil Procedure, Political Science, Court Rules, Law, Social Sciences",2018-01-04 12:13:32
031242227X,Running with Scissors: A Memoir,$0.25,$8.39,1,"Picador; 1st edition (June 1, 2003)",11,"17,470",4,,"Biographies & Memoirs, Specific Groups, New England, LGBT, Deals in Books, Regional U.S.",2018-01-04 12:13:36
006019958X,Savannah Blues,$1.45,$9.91,418,"Harper; 1st edition (February 5, 2002)",1,"557,274",2280,,"Humor, Humorous, United States, Literature & Fiction, Humor & Satire, Short Stories & Anthologies",2018-01-04 12:13:40
0849940729,Millennium: Beginning Or End?,$0.10,$6.01,3,"W Publishing Group; First Edition edition (December 9, 1999)",9,"538,704",479,,"Eschatology, Bible Study & Reference, Theology, Prophecies, Prophecy, Christian Books & Bibles",2018-01-04 12:13:44
0452282195,The Bluest Eye (Oprah's Book Club),$1.00,$6.80,1,"Plume (April 26, 2000)",7,"435,264",26130,,"Literary, Literature & Fiction",2018-01-04 12:13:47
0440224675,Hannibal,$0.25,$1.98,3,"Dell (May 23, 2000)",3,"50,506",763,,"Murder, Thrillers & Suspense, Psychological Thrillers, Crime, Serial Killers, Mystery, Thriller & Suspense",2018-01-04 12:13:54
0778314138,Love in Plain Sight: Love 'n' Marriage\Almost An Angel,$14.99,$3.75,25,"MIRA (January 29, 2013)",0,"1,254,778",89946,,"Romance, United States, Contemporary, Literature & Fiction",2018-01-04 12:13:59
1586608320,PRAYERS AND PROMISES FOR WOMEN (Inspirational Library),$1.00,$2.00,3,224 pages,5,"3,381,598",3619,,"Inspirational, Women's Issues, Worship & Devotion, Prayerbooks, Christian Living, Religion & Spirituality, Christian Books & Bibles",2018-01-04 12:14:07
0071343881,Understanding the Euro: The Clear and Concise Guide to the New Trans-European Currency,$0.99,$31.59,8,"McGraw-Hill (December 16, 1998)",1,"5,657,505",4858,,"Encyclopedias & Subject Guides, Business, Economics, Business & Money, Education & Reference, International, Reference",2018-01-04 12:14:11
0060008504,Death in Dublin: A Peter McGarr Mystery,$2.25,$5.50,9,368 pages,4,"1,819,483",16904,,"Mystery, Mystery, Thriller & Suspense, Police Procedurals",2018-01-04 12:14:14
0871238829,When Breaks the Dawn (Canadian West),$4.46,$35.22,207,224 pages,7,"1,390,475",282,,"Westerns, Romance, Western, Genre Fiction, Religious & Inspirational, Christian Books & Bibles, Literature & Fiction",2018-01-04 12:14:29
1590526503,For Young Women Only: What You Need to Know About How Guys Think,$0.25,$4.12,87,"Multnomah; No Edition Stated edition (August 7, 2006)",8,"86,130",29,,"Dating & Intimacy, Parenting & Relationships, Social Issues, Parenting Girls, Teenagers, Parenting, Teens",2018-01-04 12:14:42
1605870587,5 Minutes A Day 365 Daily Devo,$1.06,$13.44,6,384 pages,14,"1,240,353",5853,,"Worship & Devotion, Christian Living, Religion & Spirituality, Christian Books & Bibles, Devotionals",2018-01-04 12:14:45
141659485X,The Christmas Sweater,$0.10,$2.90,773,"Threshold Editions; Reissue edition (November 11, 2008)",12,"307,865",299,,"Contemporary, Holidays, Christian Living, Christmas, Christian Books & Bibles, Literature & Fiction",2018-01-04 12:14:50
0312642709,Summer Rental: A Novel,$0.25,$3.00,613,"St. Martin's Griffin; Reprint edition (May 8, 2012)",13,"694,602",1166,,"United States, Women's Fiction, Friendship, Contemporary Women, Literature & Fiction",2018-01-04 12:14:53
B00DGDLBTM,Beloved Impostor,$1.02,$20.00,21,B00DGDLBTM,12,"10,444,026",,,,2018-01-04 12:14:59
039915079X,The Teeth of the Tiger (Jack Ryan Novels),$0.25,$2.46,1,431 pages,1,"466,192",1783,,"Thrillers & Suspense, Spies & Politics, Military, Mystery, Thriller & Suspense, Terrorism, Espionage",2018-01-04 12:15:03
0975599518,"Natural Cures ""They"" Don't Want You To Know About",$0.25,$1.95,2,572 pages,2,"132,700",129,,"Naturopathy, Healing, Health, Fitness & Dieting, Herbal Remedies, Alternative Medicine",2018-01-04 12:15:08
1416543074,Women Food and God: An Unexpected Path to Almost Everything,$0.10,$2.39,893,"Scribner (March 2, 2010)",9,"109,165",123,,"Mental Health, Health, Fitness & Dieting, Addiction & Recovery, Drug Dependency, Spiritual, Self-Help, Eating Disorders",2018-01-04 12:15:13
1454704217,Never Been Stitched: 45 No-Sew & Low-Sew Projects,$1.44,$0.73,4,"Lark Crafts (February 4, 2014)",1,"1,325,513",2439,,"Crafts, Hobbies & Home, Needlecrafts & Textile Crafts, Sewing, Sewing Patterns, Crafts & Hobbies",2018-01-04 12:15:16
1451695195,Proof of Heaven: A Neurosurgeon's Journey into the Afterlife,$4.99,$12.94,10,"Simon &amp; Schuster; 1 edition (October 23, 2012)",8,"1,114",1,,"Science & Religion, Occult & Paranormal, Religion & Spirituality, Parapsychology, Reincarnation, Near-Death Experiences, New Age & Spirituality, Religious Studies",2018-01-04 12:15:21
0736904336,She's Gonna Blow!: Real Help for Moms Dealing With Anger,$0.10,$1.00,105,"Harvest House Pub (April 1, 2001)",11,"3,351,688",8875,,"Parenting & Relationships, Women's Issues, Parenting, Christian Living, Religion & Spirituality, Christian Books & Bibles",2018-01-04 12:15:24
1435114140,Yao Ming (Sports Heroes and Legends Series),$6.49,$47.98,1,Barnes &amp; Noble (2009),5,"4,193,037",,,,2018-01-04 12:15:33
1400049121,The Flyers: In Search of Wilbur & Orville Wright,$0.50,$2.94,14,"Crown (October 7, 2003)",14,"2,217,034",1713,,"Transportation, Astronomy & Space Science, Reference, Science & Math, Engineering & Transportation, Engineering, Aviation, Aeronautics & Astronautics, History",2018-01-04 12:15:37
0806917806,"10-Minute Scrapbook Pages: Hundreds of Easy, Innovative Designs",$1.89,$1.25,8,"Sterling (December 31, 2001)",1,"6,963,149",1808,,"Crafts, Hobbies & Home, Scrapbooking, Reference, Papercrafts, Stamping & Stenciling, Papercrafts, Crafts & Hobbies",2018-01-04 12:15:43
0810970686,Diary of a Wimpy Kid: The Last Straw (Book 3),$0.83,$5.00,1,3 - 7<br/>,12,"1,566",2,,"Comics & Graphic Novels, Family Life, Children's Books, Growing Up & Facts of Life, Parents, Sports & Outdoors",2018-01-04 12:15:50
0312321236,Intuitive Eating: A Revolutionary Program That Works,$1.54,$11.80,237,"St. Martin's Griffin; 2nd edition (September 11, 2003)",12,"54,116",74,,"Mental Health, Health, Fitness & Dieting, Addiction & Recovery, Drug Dependency, Weight Loss, Eating Disorders, Diets & Weight Loss",2018-01-04 12:15:54
0830745815,Simple Ideas for Healthy Living (First Place 4 Health),$1.75,$5.95,9,240 pages,12,"929,377",75615,,"Teens, Health, Fitness & Dieting",2018-01-04 12:16:02
0425194086,Judith krantz lovers,$1.66,$9.00,3,"Berkley Trade (February 3, 2004)",3,"1,824,249",329,,"Eye Problems, Exercise & Fitness, Health, Fitness & Dieting, Quick Workouts, Diseases & Physical Ailments",2018-01-04 12:16:06
1414368860,Overwhelmed: Winning the War against Worry,$1.24,$5.70,329,"Tyndale House Publishers, Inc. (April 1, 2014)",9,"494,621",1601,,"Self Help, Stress Management, Self-Help, Christian Living, Personal Growth, Christian Books & Bibles",2018-01-04 12:16:10
0310205719,The Purpose Driven Life,$0.25,$4.00,4,"Zondervan; 1st edition (October 8, 2002)",1,"7,944",99,,"Spiritual, Self Help, Self-Help, Christian Living, Spiritual Growth, Christian Books & Bibles",2018-01-04 12:16:21
0425222322,"Double Dog Dare (Kendra Ballantyne, Pet-Sitter Mystery, No. 6)",$0.25,$13.09,19,"Berkley (June 3, 2008)",5,"639,485",2076,,"Mystery, Animals, Cozy, Women Sleuths, Small Town & Rural, Mystery, Thriller & Suspense, Genre Fiction, Literature & Fiction",2018-01-04 12:16:24
1561705683,The Western Guide to Feng Shui: Room by Room,$1.09,$4.97,89,"Hay House Inc (October 1, 1999)",1,"138,799",41,,"Crafts, Hobbies & Home, Feng Shui, Other Eastern Religions & Sacred Texts, Decorating & Design, Home Improvement & Design, New Age & Spirituality, Religion & Spirituality",2018-01-04 12:16:27
084991759X,A Love Worth Giving: Living in the Overflow of God's Love,$0.10,$2.99,755,"Thomas Nelson Inc; Special ed. edition (August 1, 2002)",15,"332,610",28,,"Protestantism, Worship & Devotion, Christian Books & Bibles, Inspirational, Christian Living, Religion & Spirituality, Christian Denominations & Sects",2018-01-04 12:16:31
0399241515,Scorpia (An Alex Rider Adventure),$0.10,$4.00,627,312 pages,1,"640,644",913,,"Action & Adventure, Mystery & Detective, Thrillers & Suspense, Mystery & Thriller, Mysteries & Thrillers, Teens, Literature & Fiction",2018-01-04 12:16:36
